{
  "created_at": "2026-08-17T01:35:10Z",
  "extraction_notes": "This bounded comparative statement is attributed to the Secretary-General's report and does not assign individual criminal responsibility. Human review must confirm the category terminology, count context, and geographic scope.",
  "id": "candidate-d6b0537475ab44f2",
  "proposed_category": "humanitarian-aid",
  "proposed_claim": "The Secretary-General reported that denial of humanitarian access was the most prevalent grave violation against children verified by the United Nations in Israel and the Occupied Palestinian Territory during 2024.",
  "proposed_event_date": null,
  "proposed_legal_status": "DOCUMENTED_EVIDENCE",
  "proposed_record": null,
  "publication_date": "2025-06-17",
  "published_record_id": null,
  "related_published_records": [
    "un-sg-denial-humanitarian-access-children-2023-2024-06-03"
  ],
  "review_flags": [
    "ATTRIBUTION_REVIEW",
    "PUBLISHED_OVERLAP_REVIEW"
  ],
  "review_notes": null,
  "review_status": "NEEDS_REVIEW",
  "reviewed_at": null,
  "reviewed_by": null,
  "source_document_id": "A/79/878-S/2025/247",
  "source_organization": "United Nations",
  "source_page": "paras. 98–101",
  "source_title": "Children and armed conflict: Report of the Secretary-General",
  "source_url": "https://docs.un.org/en/A/79/878",
  "supporting_passage": null
}
