{
  "created_at": "2026-08-17T01:35:07Z",
  "extraction_notes": "Provisional extraction of the mandate holder's own analytical conclusion, not a finding of the United Nations as a whole or a court judgment. Human review must confirm the exact scope, wording, paragraph references and proposed legal status.",
  "id": "candidate-59200b860029dbed",
  "proposed_category": "displacement",
  "proposed_claim": "The Special Rapporteur concluded that the assault on Gaza should be understood within a long-term process of intentional, State-organized forced displacement and replacement of Palestinians.",
  "proposed_event_date": null,
  "proposed_legal_status": "UN_FINDING",
  "proposed_record": null,
  "publication_date": "2024-10-01",
  "published_record_id": null,
  "related_published_records": [
    "un-sr-reasonable-grounds-genocide-2024-03-25"
  ],
  "review_flags": [
    "ATTRIBUTION_REVIEW",
    "UN_FINDING_SCOPE_REVIEW",
    "PUBLISHED_OVERLAP_REVIEW"
  ],
  "review_notes": null,
  "review_status": "NEEDS_REVIEW",
  "reviewed_at": null,
  "reviewed_by": null,
  "source_document_id": "A/79/384",
  "source_organization": "United Nations Special Procedures",
  "source_page": "paras. 69, 74",
  "source_title": "Genocide as colonial erasure: Report of the Special Rapporteur on the situation of human rights in the Palestinian territories occupied since 1967",
  "source_url": "https://docs.un.org/en/A/79/384",
  "supporting_passage": null
}
