{
  "created_at": "2026-08-17T01:35:08Z",
  "extraction_notes": "Paragraphs 16–17 support the bounded proposition about evacuation orders, shrinking areas and the lack of safety in designated zones. The claim remains attributed to the Special Rapporteur; human review must check the exact wording and underlying citations and determine whether it materially overlaps the published forcible-transfer record.",
  "id": "candidate-03e68e28150d03e3",
  "proposed_category": "displacement",
  "proposed_claim": "The Special Rapporteur reported that evacuation orders forced Palestinians in Gaza into ever-shrinking areas where designated safe zones did not provide safety.",
  "proposed_event_date": null,
  "proposed_legal_status": "DOCUMENTED_EVIDENCE",
  "proposed_record": null,
  "publication_date": "2024-10-01",
  "published_record_id": null,
  "related_published_records": [
    "un-coi-forcible-transfer-gaza-2024-06-12"
  ],
  "review_flags": [
    "ATTRIBUTION_REVIEW",
    "UN_FINDING_SCOPE_REVIEW",
    "PUBLISHED_OVERLAP_REVIEW"
  ],
  "review_notes": null,
  "review_status": "NEEDS_REVIEW",
  "reviewed_at": null,
  "reviewed_by": null,
  "source_document_id": "A/79/384",
  "source_organization": "United Nations Special Procedures",
  "source_page": "paras. 16–17",
  "source_title": "Genocide as colonial erasure: Report of the Special Rapporteur on the situation of human rights in the Palestinian territories occupied since 1967",
  "source_url": "https://docs.un.org/en/A/79/384",
  "supporting_passage": null
}
